ID,Nombre,Tipo,Resumen,Descripción,Público Objetivo,Problema,Solución,Complejidad,Horas Desarrollo,Precio Estimado,MVP Features,Canales,Competencia,Diferenciación,Score Total,Landing URL,Landing Deployed,Created Date,Reasoning
IDEA-20260218052706,TaskHero,SaaS,Una plataforma que combina gestión de tareas con elementos de gamificación para mejorar la productividad de equipos remotos.,"TaskHero es una herramienta de gestión de tareas y seguimiento de proyectos que incorpora gamificación para motivar a los usuarios a completar tareas y alcanzar objetivos. Los usuarios pueden ganar puntos, alcanzar niveles y competir amistosamente con sus compañeros, lo que transforma la productividad en un juego interactivo y motivador.","Equipos remotos, freelancers y pequeñas empresas que buscan mejorar la organización y la motivación en sus entornos de trabajo.","La falta de motivación y la desorganización en la gestión de tareas son comunes en entornos laborales remotos, donde la comunicación y el seguimiento son más difíciles.","TaskHero aborda este problema al integrar la gestión de tareas con un sistema de gamificación que fomenta la competitividad sana y la colaboración, permitiendo a los usuarios ver su progreso de manera clara y atractiva.",Media,80,$10/mes por usuario,"Gestión de tareas, sistema de puntos, integración con herramientas de comunicación (como Slack), dashboard de progreso.","Marketing digital, redes sociales, webinars, asociaciones con plataformas de trabajo remoto.","Plataformas de gestión de tareas como Asana, Trello, y ClickUp que carecen de un enfoque en la gamificación.","TaskHero se destaca por su enfoque en la motivación a través de la gamificación, lo que proporciona una experiencia más atractiva para los usuarios y fomenta un ambiente colaborativo.",75,IDEA-20260218052706.html,Sí,2026-02-18T05:27:06.143993,"{""problema_identificado"": ""La gestión del tiempo y la productividad es un desafío constante para trabajadores remotos y equipos distribuidos, que a menudo enfrentan problemas de organización, comunicación y seguimiento de tareas."", ""porque_ahora"": ""Con el aumento del trabajo remoto debido a la pandemia y la tendencia hacia la flexibilidad laboral, las herramientas que faciliten la productividad y colaboración son más demandadas que nunca."", ""oportunidad"": ""Hay una creciente necesidad de soluciones que no solo organicen tareas, sino que integren herramientas de comunicación y seguimiento de objetivos de forma sencilla y accesible."", ""diferenciacion"": ""La solución no solo se enfocará en la gestión de tareas, sino que incorporará un sistema de gamificación para aumentar la motivación y el cumplimiento de objetivos, lo que no es común en las actuales aplicaciones de productividad.""}"
IDEA-20260218000035,Financiafreelance,SaaS,"Una herramienta de gestión financiera diseñada específicamente para freelancers y autónomos, que simplifica el seguimiento de ingresos y gastos.","Financiafreelance es un software que permite a los trabajadores autónomos registrar fácilmente sus ingresos y gastos, generar informes financieros y recibir recordatorios para la declaración de impuestos. También incluye recursos educativos sobre finanzas personales y fiscales.","Freelancers, trabajadores autónomos, pequeños empresarios.","Dificultad en la gestión de finanzas, falta de claridad en ingresos y gastos, y complicaciones durante la declaración de impuestos.","Una interfaz sencilla que permite a los usuarios registrar transacciones, categorizar gastos e ingresos, y generar informes que faciliten la declaración de impuestos.",Media,120,$15/mes,"Registro de ingresos y gastos, generación de informes básicos, recordatorios para impuestos.","Redes sociales, marketing de contenido, colaboración con plataformas de freelancers.","QuickBooks, Wave, FreshBooks.","Enfocarse en freelancers y autónomos con una interfaz sencilla y características adaptadas a sus necesidades específicas, proporcionando educación financiera adicional.",75,IDEA-20260218000035.html,Sí,2026-02-18T00:00:35.351578,"{""problema_identificado"": ""Los trabajadores autónomos y freelancers a menudo tienen dificultades para gestionar sus finanzas y el seguimiento de sus ingresos y gastos de forma eficiente, lo que les lleva a confusiones y problemas durante la declaración de impuestos."", ""porque_ahora"": ""La economía gig ha crecido considerablemente y más personas están optando por trabajos autónomos. Aumenta la necesidad de herramientas que faciliten la gestión financiera de estos trabajadores."", ""oportunidad"": ""El mercado de freelancers y autónomos está en expansión, con una creciente demanda de soluciones que aborden sus necesidades específicas de gestión financiera."", ""diferenciacion"": ""La propuesta de este producto es ofrecer una solución integrada que combine la gestión de ingresos, gastos, generación de informes y asistencia para la declaración de impuestos, específicamente diseñada para trabajadores independientes, a diferencia de los softwares contables tradicionales que son más complejos.""}"
IDEA-20260217230132,FocusFlow,SaaS,FocusFlow es una herramienta de gestión de tiempo y productividad diseñada específicamente para trabajadores remotos que buscan equilibrar sus tareas y descansos.,"FocusFlow permite a los usuarios planificar su jornada laboral, programar descansos adecuados y acceder a sesiones de meditación para mejorar su bienestar mental. La aplicación realiza un seguimiento del tiempo dedicado a cada tarea y envía notificaciones para recordar a los usuarios cuándo es el momento de descansar o meditar.","Trabajadores remotos, freelancers, y empleados en empresas con modelos híbridos de trabajo.","La falta de un sistema que combine gestión de tareas, descansos y salud mental en un solo lugar.","FocusFlow proporciona una solución integral para que los trabajadores remotos gestionen su tiempo de manera efectiva, mejorando así su productividad y bienestar general.",Media,150,$9.99/mes,"Planificación de tareas, recordatorios de descanso, sesiones de meditación guiada.","Redes sociales, marketing de contenido, asociaciones con plataformas de freelancers.","Toggle, Trello, y aplicaciones de meditación como Headspace.","FocusFlow no solo se enfoca en la gestión de tareas, sino que también incorpora el bienestar mental como parte fundamental de la productividad, lo cual no es común en otras herramientas.",75,IDEA-20260217230132.html,Sí,2026-02-17T23:01:32.359851,"{""problema_identificado"": ""Los trabajadores remotos enfrentan dificultades para gestionar su tiempo y mantener la productividad debido a la falta de herramientas integradas que ayuden a equilibrar tareas, descansos y la vida personal."", ""porque_ahora"": ""La tendencia del trabajo remoto ha aumentado significativamente desde la pandemia, y muchas empresas están adoptando modelos híbridos o totalmente remotos, lo que hace necesario contar con herramientas que optimicen la productividad en este nuevo entorno."", ""oportunidad"": ""Cada vez más freelancers y empleados remotos buscan soluciones que les permitan gestionar su día a día de forma eficiente, lo que crea una alta demanda de herramientas de productividad que se adapten a este estilo de trabajo."", ""diferenciacion"": ""A diferencia de otros gerentes de tiempo, nuestra aplicación integrará seguimiento de tareas, gestión de descansos y meditación guiada para reducir el estrés, todo en una sola plataforma.""}"
IDEA-20260217215257,BalancePro,SaaS,Una plataforma de gestión de productividad y bienestar para trabajadores remotos.,"BalancePro es una herramienta que combina la gestión del tiempo, el seguimiento de tareas y el bienestar personal en un solo lugar. Permite a los usuarios planificar su día, establecer recordatorios de descanso y realizar ejercicios de meditación, todo mientras rastrean su progreso y productividad.",Trabajadores remotos y freelancers que buscan optimizar su tiempo y mantener su bienestar.,"La dificultad de los trabajadores remotos para equilibrar su carga de trabajo con el autocuidado, lo que lleva a la fatiga y disminución de la productividad.",Una plataforma integrada que permite a los usuarios gestionar su tiempo de manera más efectiva mientras promueven su bienestar personal.,Media,120,$15/mes,"Gestor de tareas, Seguimiento del tiempo, Recordatorios de descanso, Ejercicios de bienestar","SEO, Marketing de contenido, Redes sociales","Trello, Asana, RescueTime, pero ninguna integra el bienestar de manera efectiva.","Enfoque en el bienestar integrado con la productividad, ofreciendo una solución holística para trabajadores remotos.",75,IDEA-20260217215257.html,Sí,2026-02-17T21:52:57.126981,"{""problema_identificado"": ""Los trabajadores remotos enfrentan dificultades para gestionar su tiempo y mantener la productividad debido a la falta de herramientas efectivas que integren la planificación de tareas, seguimiento del tiempo y la gestión del bienestar."", ""porque_ahora"": ""La tendencia del trabajo remoto ha crecido significativamente en los últimos años y se espera que continúe, lo que crea una necesidad urgente de soluciones que ayuden a estos trabajadores a optimizar su rendimiento y mantener un equilibrio trabajo-vida saludable."", ""oportunidad"": ""El mercado de herramientas de productividad para trabajadores remotos está en expansión, y hay una creciente demanda por soluciones que no solo se centren en la gestión del tiempo, sino que también integren elementos de bienestar."", ""diferenciacion"": ""A diferencia de otras herramientas de productividad, esta solución incluirá funciones de gamificación y bienestar, como recordatorios de descanso y ejercicios de meditación, para fomentar una productividad sostenible.""}"
IDEA-20260217195746,MarketEasy,SaaS,Una plataforma de marketing digital simple que automatiza campañas para pequeñas empresas con enseñanzas integradas.,"MarketEasy es una herramienta de marketing digital que permite a las pequeñas empresas crear y gestionar campañas publicitarias en redes sociales, correo electrónico y sitios web. Incluye tutoriales y guías paso a paso para empoderar a los usuarios a entender mejor el marketing digital.",Propietarios de pequeñas empresas y emprendedores que buscan mejorar su presencia digital.,Las pequeñas empresas carecen de tiempo y conocimientos para gestionar campañas de marketing digital efectivas.,"Automatiza el proceso de marketing y ofrece educación en el camino, permitiendo que los usuarios ejecuten campañas exitosas de manera sencilla.",Media,150,$29/mes,"Generador de campañas automatizadas, plantillas de correos electrónicos, análisis de rendimiento básico.","Marketing de contenido, redes sociales, asociaciones con cámaras de comercio locales.","Herramientas de marketing digital como Mailchimp y Hootsuite, pero no están centradas en la educación y la simplicidad.","MarketEasy se enfoca en la educación del usuario y en la simplicidad, convirtiéndolo en una plataforma accesible para quienes no tienen experiencia en marketing.",76,IDEA-20260217195746.html,Sí,2026-02-17T19:57:46.669686,"{""problema_identificado"": ""Las pequeñas empresas luchan por llevar a cabo campañas de marketing digital efectivas debido a la falta de recursos y conocimientos técnicos."", ""porque_ahora"": ""Con el aumento del uso de herramientas digitales y redes sociales durante y después de la pandemia, las pequeñas empresas deben adaptarse rápidamente para sobrevivir y crecer."", ""oportunidad"": ""La demanda por soluciones de marketing accesibles y efectivas está en aumento, y muchas herramientas actuales son demasiado complejas o costosas para este segmento."", ""diferenciacion"": ""La solución propuesta combina la automatización con un enfoque sencillo y educativo, permitiendo a los usuarios comprender y ejecutar campañas sin requerir experiencia previa en marketing.""}"
IDEA-20260217180921,Finanzas Sencillas,SaaS,Una plataforma de gestión financiera diseñada para PyMEs que simplifica la contabilidad y el flujo de caja mediante herramientas intuitivas y predicciones financieras.,"Finanzas Sencillas es un software en la nube que permite a las pequeñas y medianas empresas llevar un control de sus finanzas de manera fácil e intuitiva. Incluye funciones como gestión de ingresos y gastos, previsión de flujo de caja y generación de informes financieros automatizados, todo dentro de una interfaz amigable.",Pequeñas y medianas empresas que carecen de un departamento de contabilidad o que buscan optimizar su gestión financiera.,La dificultad en el manejo de finanzas lleva a las PyMEs a tener problemas graves de liquidez y toma de decisiones erróneas.,Una plataforma que permite a los propietarios de PyMEs gestionar sus finanzas de manera eficiente sin necesidad de tener un conocimiento profundo en contabilidad.,Media,150,$29/mes,"Gestión de ingresos y gastos, Previsión de flujo de caja, Generación de informes financieros.","Marketing digital (SEO, PPC), Redes sociales, Alianzas con asociaciones de empresarios.","Existen otros softwares de gestión financiera, pero suelen ser complejos o costosos, dirigidos a grandes empresas.","Finanzas Sencillas se enfoca en la Usabilidad y el soporte al cliente, brindando formación y atención personalizada a sus usuarios, además de un precio accesible.",75,IDEA-20260217180921.html,Sí,2026-02-17T18:09:21.364244,"{""problema_identificado"": ""Las pequeñas y medianas empresas (PyMEs) enfrentan dificultades para gestionar sus finanzas de manera efectiva, llevando a problemas de flujo de caja y falta de planificación financiera."", ""porque_ahora"": ""Con el aumento de las herramientas digitales y el trabajo remoto, hay una creciente necesidad de soluciones de gestión financiera que sean accesibles y fáciles de usar para las PyMEs."", ""oportunidad"": ""El mercado de software financiero para PyMEs está en crecimiento, ya que hay un número cada vez mayor de empresas que buscan soluciones digitales asequibles y efectivas."", ""diferenciacion"": ""Esta solución se centrará en una interfaz intuitiva y un enfoque de 'finanzas al alcance de todos', así como en la integración de análisis predictivo para ayudar en la planificación financiera.""}"
IDEA-20260217150952,EmprendeMarketing,SaaS,"Una plataforma integral de marketing digital diseñada para pequeños y medianos emprendedores que permite crear, gestionar y analizar campañas de marketing de forma sencilla y efectiva.","EmprendeMarketing proporciona a los emprendedores herramientas para diseñar gráficos atractivos, programar publicaciones en redes sociales, y analizar el rendimiento de sus campañas, todo en un solo lugar y con una interfaz intuitiva.","Emprendedores, pequeños negocios y freelancers que buscan mejorar su presencia digital y aumentar sus ventas.",Los emprendedores a menudo carecen del conocimiento técnico y los recursos financieros para implementar estrategias de marketing digitales efectivas.,"EmprendeMarketing simplifica el proceso de marketing al ofrecer herramientas accesibles y fáciles de usar, además de recursos educativos que ayudan a los usuarios a maximizar el impacto de sus campañas.",Media,120,$29/mes o $299 one-time,"Diseñador gráfico sencillo, Programador de publicaciones en redes sociales, Análisis de rendimiento básico","SEO, Publicidad en redes sociales, Marketing de contenidos","Canva, Hootsuite, Mailchimp","En lugar de ofrecer herramientas genéricas, EmprendeMarketing se centra en las necesidades específicas de los emprendedores facilitando una experiencia personalizada y educativa.",75,IDEA-20260217150952.html,Sí,2026-02-17T15:09:52.521751,"{""problema_identificado"": ""Los pequeños y medianos emprendedores a menudo luchan por acceder a herramientas de marketing digital efectivas y asequibles que les permitan destacar en un mercado competitivo."", ""porque_ahora"": ""Con el aumento del comercio electrónico y la digitalización acelerada debido a la pandemia, existe una creciente necesidad de soluciones de marketing accesibles y efectivas para pequeñas empresas."", ""oportunidad"": ""El mercado de las pequeñas empresas sigue en expansión a medida que más personas optan por emprender, lo que crea una oportunidad significativa para ofrecer herramientas de marketing especializadas y asequibles."", ""diferenciacion"": ""Ofrecer una plataforma todo en uno que combina herramientas de diseño gráfico, automatización de redes sociales y análisis de rendimiento, específicamente adaptada para emprendedores, con un enfoque en la facilidad de uso.""}"
IDEA-20260217120357,MarketAssist AI,SaaS,Plataforma de marketing digital impulsada por inteligencia artificial que ayuda a pequeñas empresas a gestionar y automatizar sus campañas de marketing.,"MarketAssist AI es una solución de marketing digital accesible que utiliza inteligencia artificial para ofrecer estrategias de marketing personalizadas y automatizadas a pequeñas empresas. Permite la creación de contenido, la gestión de redes sociales y el análisis de resultados, todo a través de un panel fácil de usar.",Pequeñas y medianas empresas (PYMEs) que carecen de un departamento de marketing o de experiencia en marketing digital.,Las PYMEs suelen tener recursos limitados y no saben cómo ejecutar campañas de marketing efectivas en el entorno digital actual.,"MarketAssist AI ofrece una plataforma integral que simplifica el proceso de marketing digital, personalizando las estrategias para que cada usuario pueda ejecutar campañas exitosas sin necesidad de experiencia previa.",Media,150,$30/mes,"Generador de contenido, Programador de publicaciones en redes sociales, Análisis básico de resultados.","Marketing en redes sociales, SEO, Publicidad pagada en Google y redes sociales.","Hootsuite, Mailchimp, HubSpot (pero este último es costoso para PYMEs).","A diferencia de las herramientas existentes, MarketAssist AI ofrece una personalización basada en IA que adapta las estrategias a las necesidades específicas de cada empresa, haciendo que sea más accesible y efectiva para PYMEs.",75,IDEA-20260217120357.html,Sí,2026-02-17T12:03:57.383442,"{""problema_identificado"": ""Las pequeñas empresas luchan por gestionar y automatizar sus procesos de marketing digital debido a la falta de recursos y conocimientos técnicos."", ""porque_ahora"": ""Con el aumento del trabajo remoto y la digitalización de las empresas, la necesidad de herramientas que faciliten el marketing digital se ha vuelto crítica."", ""oportunidad"": ""Cada vez más pequeñas empresas buscan soluciones asequibles y fáciles de usar para manejar sus campañas de marketing. La competencia en el espacio de marketing digital se ha intensificado, creando una necesidad de diferenciación."", ""diferenciacion"": ""La propuesta se centra en ofrecer un asistente de marketing AI que personaliza las estrategias de marketing según el perfil y necesidades específicas de cada empresa, utilizando una interfaz intuitiva.""}"
IDEA-20260217103239,WorkWell,SaaS,"Una plataforma de productividad que promueve el bienestar del trabajador remoto, integrando gestión de tareas y herramientas de autocuidado.","WorkWell es una aplicación que ayuda a los trabajadores remotos a gestionar su tiempo y tareas de manera eficiente, integrando recordatorios para descansos, ejercicios de respiración y autoevaluaciones de bienestar. La plataforma también ofrece análisis sobre hábitos de trabajo y recomendaciones personalizadas.",Trabajadores remotos y freelancers que luchan por mantener un equilibrio entre trabajo y vida personal.,La falta de límites claros entre el trabajo y la vida personal puede provocar agotamiento y productividad reducida.,"WorkWell ofrece una solución integral combinando tareas y bienestar en un solo lugar, ayudando a los empleados a evitar el agotamiento.",Media,120,$15/mes,"Gestor de tareas, recordatorios de bienestar, análisis de hábitos de trabajo.","Marketing en redes sociales, publicidad dirigida en LinkedIn, asociaciones con comunidades de freelancers.","Trello, Todoist, Headspace, Calm.","A diferencia de los gestores de tareas tradicionales, WorkWell integra la gestión de la productividad con el bienestar emocional, lo que no se aborda adecuadamente en el mercado actual.",75,IDEA-20260217103239.html,Sí,2026-02-17T10:32:39.280967,"{""problema_identificado"": ""Los trabajadores remotos enfrentan dificultades para gestionar el equilibrio entre trabajo y vida personal, lo que lleva a la sobrecarga laboral y al agotamiento emocional."", ""porque_ahora"": ""Con el aumento del trabajo remoto debido a la pandemia, muchas personas todavía están adaptándose a este nuevo estilo de vida, lo que hace que la gestión de la productividad personal sea más relevante que nunca."", ""oportunidad"": ""Las herramientas actuales de productividad se centran en la gestión de tareas, pero no abordan de manera integral la salud mental y el bienestar del empleado, dejando un vacío en el mercado."", ""diferenciacion"": ""Nuestra solución integrará herramientas de gestión de tareas con recordatorios de bienestar, técnicas de mindfulness y análisis de hábitos de trabajo, lo que no ofrecen las plataformas existentes.""}"
IDEA-20260217075745,SocialSimple,SaaS,"Una plataforma de gestión de redes sociales diseñada específicamente para pequeñas y medianas empresas que simplifica la programación, el análisis y el compromiso de manera automatizada.","SocialSimple permite a las PYMES crear, programar y analizar publicaciones en múltiples plataformas de redes sociales desde un solo lugar. Incluye herramientas de inteligencia artificial que sugieren contenido relevante y horarios óptimos de publicación, además de un analizador de rendimiento sencillo que ayuda a las empresas a entender su crecimiento y engagement.",Pequeñas y medianas empresas (PYMES) que buscan mejorar su presencia en redes sociales sin necesidad de recursos excesivos.,"Las PYMES luchan con la gestión de sus redes sociales debido a la falta de conocimiento, tiempo y recursos dedicados a marketing digital.","Ofrecer una plataforma todo en uno que automatice la creación de contenido y la programación de publicaciones, mientras proporciona análisis claros y sugerencias para mejorar la interacción y el crecimiento.",Media,120,$29/mes,"Programación de publicaciones, Análisis básico de rendimiento, Sugerencias automatizadas de contenido","SEO, Publicidad en redes sociales, Marketing de contenidos","Hootsuite, Buffer, Later","Enfoque específico en PYMES, con un diseño intuitivo y un análisis simplificado que se adapta a las necesidades y capacidades de este segmento de mercado.",75,IDEA-20260217075745.html,Sí,2026-02-17T07:57:45.961373,"{""problema_identificado"": ""Las pequeñas y medianas empresas (PYMES) a menudo carecen de herramientas efectivas para gestionar sus redes sociales de manera eficiente, lo que resulta en una presencia digital débil y un bajo compromiso de la audiencia."", ""porque_ahora"": ""La digitalización y la presencia en redes sociales se han vuelto críticas para el crecimiento de las PYMES, especialmente después de la pandemia, que aceleró la necesidad de una comunicación efectiva online."", ""oportunidad"": ""Con el aumento de usuarios activos en redes sociales y la implementación de estrategias de marketing digital, existe una gran demanda de soluciones que simplifiquen la gestión de estas plataformas para las PYMES."", ""diferenciacion"": ""A diferencia de otras herramientas de gestión de redes sociales, esta solución se centrará específicamente en PYMES y ofrecerá un enfoque automatizado y fácil de usar que no requiere conocimientos técnicos previos.""}"
