ID,Nombre,Tipo,Resumen,Descripción,Público Objetivo,Problema,Solución,Complejidad,Horas Desarrollo,Precio Estimado,MVP Features,Canales,Competencia,Diferenciación,Score Total,Landing URL,Landing Deployed,Created Date,Reasoning
IDEA-20260212220316,MindManage,SaaS,"Una plataforma SaaS para la gestión de prácticas de bienestar mental que incluye gestión de citas, recordatorios, y seguimiento de clientes.","MindManage es una herramienta de gestión diseñada específicamente para terapeutas y profesionales de la salud mental, que les permite organizar citas, enviar recordatorios automáticos a sus clientes y hacer un seguimiento de su progreso de manera eficiente. La plataforma también incluirá recursos educativos para que los profesionales estén actualizados en su campo.","Psicólogos, terapeutas, coaches y otros profesionales de la salud mental.","Dificultades en la gestión de citas y seguimiento de los clientes, lo que lleva a una experiencia insatisfactoria tanto para el profesional como para el cliente.","MindManage proporciona una plataforma intuitiva que centraliza la gestión de citas, recordatorios y seguimiento del progreso de los clientes, mejorando la eficiencia de los profesionales y la satisfacción del cliente.",Media,150,$29/mes,"Gestión de citas, Recordatorios automáticos, Seguimiento del progreso del cliente","Marketing en redes sociales, Webinars y talleres para terapeutas, Colaboraciones con instituciones de salud mental","Existen otras herramientas de gestión, pero suelen estar fragmentadas o no enfocadas exclusivamente en el bienestar mental.","MindManage combina gestión de citas, recordatorios y seguimiento en una única plataforma enfocada en las necesidades de los profesionales de la salud mental.",75,IDEA-20260212220316.html,Sí,2026-02-12T22:03:16.453201,"{""problema_identificado"": ""Los profesionales del bienestar mental (psicólogos, terapeutas, coaches) tienen dificultades para gestionar sus citas, recordatorios y el seguimiento de sus clientes de manera eficiente. Esto les lleva a perder tiempo o a tener clientes insatisfechos por problemas en la comunicación y organización."", ""porque_ahora"": ""La creciente aceptación de la telemedicina y el bienestar mental, sumado al aumento de la digitalización en servicios de salud, hace que este sea un momento propicio para ofrecer soluciones digitales que mejoren la gestión de la práctica de estos profesionales."", ""oportunidad"": ""El mercado de la salud mental está en constante crecimiento. Con un número creciente de profesionales ofreciendo servicios, existe una demanda evidente por herramientas que faciliten la gestión administrativa y mejoren la experiencia del cliente."", ""diferenciacion"": ""La solución se diferencia de otros productos en el mercado al integrar la gestión de citas con un recordatorio automatizado y una plataforma de seguimiento de progreso para los clientes, todo en un solo lugar.""}"
IDEA-20260212210603,FreelanceFlow,SaaS,"Una herramienta de gestión de proyectos diseñada específicamente para freelancers, que combina seguimiento de tareas, comunicación con clientes y gestión de pagos en una única plataforma.","FreelanceFlow permite a los freelancers organizar sus proyectos, comunicarse con sus clientes de forma directa a través de la plataforma y gestionar los pagos de manera eficiente, todo en un solo lugar. La plataforma prioriza la facilidad de uso y la versatilidad, facilitando a los usuarios mantenerse organizados y conectados.","Freelancers y pequeños empresarios en sectores creativos como diseño gráfico, desarrollo web, marketing digital, etc.","La falta de una solución integral para gestionar proyectos y la comunicación con clientes, lo cual lleva a la pérdida de tiempo y posibles ingresos.","FreelanceFlow facilitará la gestión de proyectos, la comunicación y la facturación, permitiendo a los freelancers concentrarse en su trabajo en lugar de en la administración.",Media,120,$10/mes,"Gestión de tareas, Mensajería integrada, Facturación básica","Marketing en redes sociales, Colaboraciones con plataformas de freelancing, Blogs y podcasts sobre freelancing.","Trello, Asana, Monday.com, pero todas estas herramientas son más generales y no están adaptadas específicamente a las necesidades de los freelancers.","FreelanceFlow se centra en ofrecer una experiencia de usuario simplificada y adaptada a las necesidades concretas de los freelancers, a diferencia de competidores más complejos.",75,IDEA-20260212210603.html,Sí,2026-02-12T21:06:03.526358,"{""problema_identificado"": ""Muchos freelancers y pequeños empresarios tienen dificultades para gestionar sus proyectos y la comunicación con sus clientes de manera efectiva, lo que provoca retrasos y descontento."", ""porque_ahora"": ""Con el incremento del trabajo remoto y la economía freelance, hay una creciente necesidad de herramientas que faciliten la gestión de proyectos y la comunicación de manera integrada y sencilla."", ""oportunidad"": ""Las soluciones actuales tienden a ser complejas y abarrotadas de funciones, lo que genera confusión. Hay espacio para una herramienta más simplificada y centrada en usuarios no técnicos."", ""diferenciacion"": ""La propuesta de valor se centra en la simplicidad y la funcionalidad específica para freelancers, a diferencia de otras herramientas que son más generales o complejas.""}"
IDEA-20260212195523,Freelancer Hub,SaaS,"Una plataforma integral para freelancers que combina gestión de proyectos, control de tiempo y procesamiento de pagos.","Freelancer Hub es una herramienta que permite a los freelancers administrar sus proyectos, realizar un seguimiento de su tiempo y gestionar sus ingresos de forma sencilla y eficaz. Ofrece reportes de productividad y permite la integración con plataformas de pago como PayPal y Stripe.","Freelancers en sectores creativos, técnicos y de servicios profesionales.",La dispersión de herramientas y la falta de un sistema unificado que les permita gestionar todos los aspectos de su negocio.,"Un sistema que unifica gestión de proyectos, seguimiento de tiempo y administración de pagos, mejorando la productividad y reduciendo el estrés.",Media,120,$15/mes o $150 one-time (con acceso a todas las funciones),"Gestión de proyectos, Seguimiento de tiempo, Gestión de pagos, Informes de productividad.","SEO, Marketing en redes sociales, Anuncios pagados en plataformas de freelancers.","Trello, Asana, Harvest, pero ninguno ofrece todas las funciones en una sola plataforma enfocada en freelancers.","Integración directa con plataformas de pago y enfoque específico en freelancers, lo que permite una solución más adaptada a sus necesidades únicas.",70,IDEA-20260212195523.html,Sí,2026-02-12T19:55:23.807533,"{""problema_identificado"": ""La falta de un espacio centralizado para que los freelancers gestionen su tiempo, proyectos y pagos de manera eficiente, lo que lleva a la reducción de productividad y estrés."", ""porque_ahora"": ""El incremento en la economía gig debido a la pandemia ha llevado a un incremento en el número de freelancers que necesitan herramientas que les ayuden a gestionar su trabajo eficazmente."", ""oportunidad"": ""Con el crecimiento continuo del trabajo remoto y freelance, hay una necesidad urgente de herramientas que integren gestión de proyectos, gestión del tiempo y gestión de pagos en un solo lugar."", ""diferenciacion"": ""A diferencia de otras herramientas en el mercado, esta solución se enfocará específicamente en freelancers y ofrecerá integraciones directas con plataformas de pago y gestión de tareas, todo en una sola aplicación.""}"
IDEA-20260212181056,Productividad Personal Pro,SaaS,Plataforma que ayuda a trabajadores remotos a gestionar su tiempo y aumentar su productividad a través de análisis de hábitos y recomendaciones personalizadas.,"Productividad Personal Pro es una herramienta que permite a los usuarios registrar su tiempo en diferentes tareas, visualizar su rendimiento a lo largo de la semana y recibir consejos personalizados para optimizar su día a día. Además, facilita la integración de técnicas de gestión del tiempo, como la técnica Pomodoro y la planificación semanal.",Trabajadores remotos y autónomos que buscan mejorar su gestión del tiempo y ser más productivos.,Dificultades para mantener la productividad en entornos de trabajo remoto y falta de claridad sobre cómo se utiliza el tiempo personal.,"Una plataforma que no solo registra el tiempo, sino que también analiza los hábitos de trabajo y ofrece recomendaciones personalizadas para mejorar la eficiencia.",Media,120,$10/mes,"Registro de tiempo, Análisis de hábitos, Recomendaciones personalizadas","Redes sociales, Marketing de contenido, Colaboraciones con influencers en productividad","Trello, Todoist, RescueTime","Enfoque específico en la productividad personal y análisis de hábitos, además de recomendaciones personalizadas, en lugar de solo gestión de tareas.",75,IDEA-20260212181056.html,Sí,2026-02-12T18:10:56.117740,"{""problema_identificado"": ""Los trabajadores remotos enfrentan dificultades para gestionar su tiempo y mantener la productividad, a menudo se sienten abrumados por la falta de estructura."", ""porque_ahora"": ""El auge del teletrabajo ha impulsado el interés en herramientas que ayuden a optimizar la productividad personal y la gestión del tiempo."", ""oportunidad"": ""La creciente populación de trabajadores remotos busca soluciones que se integren con sus rutinas diarias y ofrezcan seguimiento y análisis del tiempo dedicado a distintas tareas."", ""diferenciacion"": ""A diferencia de las herramientas de gestión de proyectos convencionales, esta solución se centra en la gestión del tiempo y la productividad personal, ofreciendo análisis de hábitos y recomendaciones personalizadas.""}"
IDEA-20260212151038,WellNest,SaaS,Una plataforma que combina la gestión del tiempo y el bienestar mental para equipos remotos.,"WellNest es una herramienta SaaS que ayuda a los trabajadores remotos a gestionar su tiempo de manera eficaz mientras promueve la salud mental a través de actividades de bienestar, meditación guiada y sesiones de 'check-in' grupales. Los usuarios pueden programar su tiempo de trabajo y bienestar en la misma plataforma, fomentando un equilibrio saludable entre ambas áreas.","Empresas con equipos remotos, freelancers y trabajadores independientes.",El aislamiento y la sobrecarga de trabajo en entornos remotos afectan la productividad y la salud mental de los trabajadores.,"Ofrecer una plataforma que combine la gestión del tiempo con sesiones de bienestar mental, facilitando una cultura empresarial más saludable y productiva.",Media,120,$15/mes por usuario,"Gestión del tiempo, sesiones de bienestar, reportes de productividad, integración con calendarios.","Marketing digital, webinars, asociaciones con empresas de recursos humanos.","Slack, Zoom, Noom, plataformas de gestión del tiempo.","WellNest no solo proporciona herramientas de gestión, sino que también incorpora el bienestar mental de manera integral, creando un espacio saludable para los equipos remotos.",75,IDEA-20260212151038.html,Sí,2026-02-12T15:10:38.328992,"{""problema_identificado"": ""Los trabajadores remotos tienen dificultades para mantener la productividad y la conexión con sus equipos, lo que puede resultar en un aumento del aislamiento profesional y una disminución de la eficacia laboral."", ""porque_ahora"": ""La cultura del trabajo remoto se ha institucionalizado debido a la pandemia, y cada vez más empresas buscan herramientas que fortalezcan la colaboración y el bienestar de sus equipos distribuidos."", ""oportunidad"": ""La creciente necesidad de conectar a los empleados a través de experiencias virtuales efectivas presenta una oportunidad para crear soluciones que no solo aborden la productividad, sino también el bienestar emocional de los trabajadores."", ""diferenciacion"": ""La plataforma integra funcionalidades de gestión del tiempo y bienestar mental, proporcionando un enfoque holístico sobre la productividad, a diferencia de las herramientas que solo se centran en la gestión del tiempo.""}"
IDEA-20260212120453,PyMe Online,SaaS,Una plataforma integral para que pequeñas y medianas empresas creen su presencia en línea de forma sencilla y efectiva.,"PyMe Online es una solución basada en la nube que permite a las pequeñas y medianas empresas crear, gestionar y optimizar su presencia en línea. La plataforma ofrece herramientas para diseñar sitios web atractivos, gestionar redes sociales y realizar ventas en línea, todo desde un único panel de control.",Pequeñas y medianas empresas que buscan digitalizarse y mejorar su presencia en línea.,"Las PYMEs a menudo carecen de conocimientos técnicos y recursos para establecer una presencia sólida en línea, lo que limita sus oportunidades de crecimiento y ventas.","PyMe Online proporciona una plataforma fácil de usar que combina diseño de sitios web, gestión de redes sociales y herramientas de ventas, permitiendo a las PYMEs concentrarse en su negocio principal sin preocuparse por la tecnología.",Media,120,$29/mes,"Creación de sitios web, gestión de redes sociales, herramientas de venta en línea.","Marketing digital (SEO, SEM), redes sociales, asociaciones con cámaras de comercio locales.","Wix, Squarespace, Shopify (aunque cada uno se especializa en una sola área).","Ofrecemos un enfoque holístico que combina varias herramientas que suelen estar separadas, además de un soporte personalizado para los usuarios, lo que no es común en los competidores existentes.",75,IDEA-20260212120453.html,Sí,2026-02-12T12:04:53.682267,"{""problema_identificado"": ""Las pequeñas y medianas empresas (PYMEs) luchan por establecer una presencia efectiva en línea debido a la falta de recursos y conocimientos técnicos, lo que les impide competir con empresas más grandes."", ""porque_ahora"": ""Con el crecimiento acelerado del comercio electrónico y la digitalización impulsada por la pandemia, las PYMEs necesitan herramientas accesibles y efectivas para establecer su presencia en línea y atraer clientes."", ""oportunidad"": ""Existen pocas soluciones que ofrezcan un enfoque integral y fácil de usar para que las PYMEs creen y gestionen sus sitios web, marketing digital y ventas en línea de manera efectiva."", ""diferenciacion"": ""La propuesta se diferenciará por ser una plataforma todo en uno que combina la creación de sitios web, gestión de redes sociales y herramientas de ventas en un solo lugar, enfocándose en la facilidad de uso y la atención al cliente.""}"
IDEA-20260212103029,FocusBoost,SaaS,Una herramienta de gestión de tareas que combina técnicas de productividad con gamificación para freelancers.,"FocusBoost es una plataforma en línea que ayuda a los freelancers a gestionar su tiempo y tareas utilizando enfoques modernos de productividad. A través de técnicas de Pomodoro, gamificación y un sistema de recompensas, los usuarios pueden mejorar su enfoque y efectividad laboral. Además, permite la integración con otras herramientas de gestión de proyectos y calendarios.","Freelancers, autónomos y pequeños emprendedores que buscan mejorar su productividad.",La falta de una estructura clara y motivación para manejar sus responsabilidades diarias lleva a los freelancers a procrastinar y ser menos productivos.,"Ofrecer una plataforma fácil de usar que no solo ayude a organizar tareas, sino que también incentive la productividad a través de gamificación y técnicas de manejo del tiempo.",Media,120,$10/mes,"Gestión de tareas, temporizador Pomodoro, sistema de recompensas, integración con herramientas populares (Trello, Google Calendar).","Redes sociales, marketing de contenido, partnerships con influencers del ámbito freelance.","Todoist, Trello, Asana.",Enfoque en freelancers con características únicas de gamificación y un sistema de recompensas que no ofrecen las herramientas de la competencia.,75,IDEA-20260212103029.html,Sí,2026-02-12T10:30:29.561377,"{""problema_identificado"": ""Muchos profesionales independientes (freelancers) enfrentan dificultades para gestionar su tiempo y tareas, lo que les lleva a la procrastinación y la disminución de su productividad."", ""porque_ahora"": ""Con el aumento del trabajo remoto y la cultura del freelance, la demanda por herramientas que optimicen la gestión del tiempo y las tareas ha crecido, especialmente post-pandemia."", ""oportunidad"": ""La digitalización de procesos y el enfoque en la productividad personal están en auge, creando una oportunidad para una herramienta que combine gestión de tareas con técnicas de productividad probadas."", ""diferenciacion"": ""A diferencia de otras herramientas de gestión de tareas, nuestra solución integrará técnicas de productividad como Pomodoro, metodologías ágiles y gamificación para motivar a los usuarios a completar sus tareas.""}"
IDEA-20260212075955,TeamBond,SaaS,Una plataforma de colaboración digital que facilita mini-reuniones y actividades de equipo para mejorar la comunicación y cohesión en entornos de trabajo remoto.,"TeamBond es una herramienta que permite a los equipos realizar mini-reuniones de 10 a 15 minutos, combinando video, chat y dinámicas de grupo. La plataforma incluye templatede actividades, encuestas rápidas y espacios para compartir logros, lo que fomenta la interacción y mejora el bemalong de los empleados.",Equipos de pequeñas y medianas empresas que trabajan de forma remota o híbrida y buscan mejorar la comunicación y cohesión del equipo.,La falta de interacciones significativas en entornos de trabajo remotos puede dar lugar a la desconexión entre los miembros del equipo.,"TeamBond ofrece una solución simple y divertida para realizar interacciones rápidas y efectivas, ayudando a los equipos a sentirse más conectados y motivados.",Media,120,$10/mes por usuario,"Funcionalidad de video conferencia, plantillas de mini-reuniones, chat en tiempo real.","Marketing en redes sociales, contenido educativo en blogs, publicidad dirigida en plataformas como LinkedIn.","Herramientas de colaboración como Zoom, Microsoft Teams, pero estas no suelen centrarse específicamente en mini-interacciones dinámicas.","A diferencia de las herramientas más complejas, TeamBond se enfoca en la simplicidad y en la creación de interacciones significativas que son rápidas y efectivas.",70,IDEA-20260212075955.html,Sí,2026-02-12T07:59:55.366165,"{""problema_identificado"": ""El trabajo remoto ha aumentado, pero la comunicación y colaboración entre equipos dispersos sigue siendo un desafío, lo que lleva a malentendidos, baja productividad y un sentimiento de aislamiento."", ""porque_ahora"": ""Con el crecimiento del trabajo remoto y híbrido, las herramientas de colaboración digital son más relevantes que nunca, y hay una demanda creciente de soluciones que favorezcan la cohesión del equipo."", ""oportunidad"": ""Las actuales herramientas de colaboración a menudo son complejas y saturadas de funcionalidades que no todos utilizan, lo que abre la puerta para una solución más sencilla y centrada en la experiencia del usuario."", ""diferenciacion"": ""Nuestra solución se centra en la creación de 'mini-reuniones' virtuales mediante una plataforma que integra video, chat y herramientas de colaboración de manera intuitiva y divertida, promoviendo la conexión humana.""}"
IDEA-20260212051937,ContentGenius,SaaS,"Una plataforma que utiliza IA para generar contenido atractivo y personalizado para redes sociales, optimizando la conexión entre los emprendedores y su audiencia.","ContentGenius permite a los emprendedores ingresar información básica sobre su negocio y su audiencia objetivo. A través de algoritmos de IA, genera automáticamente publicaciones de texto e imágenes para plataformas como Instagram, Facebook y Twitter, ahorrando tiempo y mejorando la calidad del contenido publicado.","Emprendedores, pequeñas y medianas empresas que buscan mejorar su marketing en redes sociales.",Falta de tiempo y habilidades para crear contenido atractivo y relevante para las redes sociales.,Proporcionar una herramienta fácil de usar que genere contenido optimizado para cada negocio y su audiencia mediante inteligencia artificial.,Media,120,$29/mes,"Generación de texto, generación de imágenes, integración con redes sociales, análisis de rendimiento del contenido.","Marketing digital, redes sociales, colaboraciones con influencers, blogs de negocios.","Herramientas como Canva o Hootsuite, pero con un enfoque más fuerte en la personalización mediante IA.",La personalización mediante IA que adapta el contenido al público objetivo específico de cada negocio.,75,IDEA-20260212051937.html,Sí,2026-02-12T05:19:37.725698,"{""problema_identificado"": ""Los emprendedores y pequeñas empresas a menudo luchan por generar contenido atractivo y de calidad para sus redes sociales, lo que les impide conectarse con su audiencia y aumentar su visibilidad."", ""porque_ahora"": ""Con el auge de las redes sociales como plataformas clave para la comercialización, la demanda por contenido de calidad nunca ha sido tan alta. Además, muchas empresas buscan formas rentables y eficientes de mejorar su presencia online."", ""oportunidad"": ""El mercado de herramientas de contenido para redes sociales está en crecimiento, y hay una necesidad insatisfecha de soluciones que faciliten el proceso de creación de contenido sin requerir habilidades avanzadas de diseño o marketing."", ""diferenciacion"": ""Esta solución utilizará inteligencia artificial para generar contenido personalizado basado en la audiencia de cada negocio, lo que la diferencia de otras herramientas que ofrecen plantillas genéricas o editores de texto.""}"
IDEA-20260211235822,Invengo,SaaS,"Invengo es una plataforma de gestión de inventario diseñada específicamente para pequeñas y medianas empresas, permitiéndoles optimizar su cadena de suministro de manera efectiva y asequible.","Invengo proporciona a las pymes una herramienta fácil de usar para gestionar sus inventarios, realizar seguimiento de productos y pronosticar necesidades futuras, integrando además funciones de análisis de ventas para mejorar la toma de decisiones.",Pequeñas y medianas empresas que buscan mejorar la gestión de su inventario y optimizar la cadena de suministro.,"Las pymes enfrentan desafíos en la gestión eficiente de su inventario, lo que resulta en costos elevados y una falta de visibilidad sobre sus procesos logísticos.","Invengo ofrece una solución integral que incluye gestión de inventario en tiempo real, herramientas de pronóstico de demanda, y reportes que permiten una mejor visibilidad y control sobre la logística.",Media,100,$29/mes,"Gestión de inventario, Reportes de ventas, Integración con plataformas de e-commerce","Redes sociales, Publicidad digital, Asociaciones con cámaras de comercio","Herramientas de gestión de inventario como TradeGecko y Unleashed, que son más caras y complejas para las pymes.","Invengo se distingue por su enfoque en la simplicidad y el costo accesible, ofreciendo características específicas que responden a las necesidades de las pymes, a diferencia de opciones más complejas y costosas.",75,IDEA-20260211235822.html,Sí,2026-02-11T23:58:22.831990,"{""problema_identificado"": ""Las pequeñas y medianas empresas (pymes) carecen de herramientas accesibles y efectivas para gestionar sus inventarios y optimizar la cadena de suministro, lo que les genera pérdidas económicas y problemas de satisfacción del cliente."", ""porque_ahora"": ""Con el aumento del e-commerce y la necesidad de agilidad en las operaciones, las pymes buscan soluciones tecnológicas asequibles que les ayuden a ser competitivas en un mercado en rápida evolución."", ""oportunidad"": ""El mercado de software de gestión de inventarios y logística está en crecimiento, especialmente tras la pandemia, que ha hecho que más empresas busquen digitalizar sus operaciones."", ""diferenciacion"": ""A diferencia de las soluciones existentes que son costosas y complejas, esta propuesta se centra en ofrecer una interfaz intuitiva y funciones específicas para pymes, con capacidades de integración sencilla a otras plataformas comerciales.""}"
