ID,Nombre,Tipo,Resumen,Descripción,Público Objetivo,Problema,Solución,Complejidad,Horas Desarrollo,Precio Estimado,MVP Features,Canales,Competencia,Diferenciación,Score Total,Landing URL,Landing Deployed,Created Date,Reasoning
IDEA-20260216052311,BalanceBuddy,SaaS,"Una plataforma de gestión del tiempo que prioriza tareas según la energía y bienestar del usuario, promoviendo un equilibrio saludable entre trabajo y vida personal.","BalanceBuddy permite a los usuarios ingresar sus tareas diarias y, utilizando un algoritmo de priorización, sugiere cuáles son las más importantes de acuerdo con el nivel de energía y estado de ánimo. Además, incluye recordatorios de autocuidado y técnicas de mindfulness para mejorar el bienestar general.","Profesionales que trabajan desde casa, freelancers, y cualquier persona que desee mejorar su productividad y bienestar personal.","La dificultad para gestionar el tiempo y las tareas en un entorno de trabajo remoto, lo que lleva a la sobrecarga y al estrés.","Una plataforma que ayuda a los usuarios a priorizar y gestionar sus actividades diarias basadas en su estado emocional y energía, ayudando así a evitar el agotamiento.",Media,120,$15/mes,"Registro de tareas, algoritmo de priorización, recordatorios de autocuidado, integración con calendarios.","Marketing digital (SEO, redes sociales), partnerships con blogs de productividad, webinars y demostraciones online.","Trello, Todoist, Asana.","Enfoque único en el bienestar y la energía del usuario, además de la gestión de tareas, mientras que la competencia se centra más en la organización y el seguimiento.",75,IDEA-20260216052311.html,Sí,2026-02-16T05:23:11.320819,"{""problema_identificado"": ""La sobrecarga de información y el caos en la gestión del tiempo personal, especialmente entre profesionales que trabajan desde casa o freelancers."", ""porque_ahora"": ""Con el aumento del trabajo remoto, muchas personas luchan por equilibrar sus tareas laborales y personales, y buscan herramientas que les ayuden a manejar su tiempo y prioridades de manera más efectiva."", ""oportunidad"": ""El mercado de herramientas de productividad ha crecido significativamente, y hay una demanda creciente por soluciones que no solo gestionen tareas, sino que también ayuden a establecer un equilibrio entre el trabajo y la vida personal."", ""diferenciacion"": ""A diferencia de otras herramientas de gestión de tareas, este producto se centra en la priorización de actividades basándose en la energía y el bienestar personal del usuario, integrando elementos de bienestar y mindfulness.""}"
IDEA-20260215235446,RecomendaMe,SaaS,Una plataforma de recomendaciones de productos personalizadas que ayuda a los consumidores a encontrar lo que realmente necesitan.,"RecomendaMe es una plataforma SaaS que utiliza inteligencia artificial para analizar el comportamiento del usuario y sus preferencias, proporcionando recomendaciones de productos personalizadas a través de un sistema conversacional y fácil de usar.","Consumidores de entre 18 y 45 años, especialmente aquellos que compran en línea y buscan opiniones más específicas y relevantes.",Los consumidores se sienten abrumados por la cantidad de opciones disponibles y tienen dificultades para decidir qué productos comprar.,"Proporcionar recomendaciones personalizadas basadas en datos sobre las preferencias del usuario y las tendencias del mercado, utilizando un sistema de AI que mejora con el tiempo.",Media,150,$19/mes,"Registro de usuario, recomendaciones personalizadas, interfaz de usuario amigable, sistema de retroalimentación, integración con plataformas de comercio electrónico (API).","Marketing en redes sociales, colaboraciones con influencers, SEO y marketing de contenido, publicidad en línea.","Plataformas de reseñas como Trustpilot, Google Reviews y otras soluciones de recomendaciones, pero ninguna ofrece personalización basada en comportamiento.","Utiliza un enfoque algorítmico único para aprender de las elecciones de los usuarios, proporcionando recomendaciones más precisas y relevantes, a diferencia de las soluciones de reseñas más genéricas.",72,IDEA-20260215235446.html,Sí,2026-02-15T23:54:46.126977,"{""problema_identificado"": ""La sobreabundancia de información y opciones en internet dificulta la toma de decisiones sobre qué productos adquirir, generando indecisión y frustración en los consumidores."", ""porque_ahora"": ""El aumento del comercio electrónico y el acceso a productos de todo tipo ha hecho que los consumidores se sientan abrumados. La necesidad de encontrar recomendaciones personalizadas y confiables es más urgente que nunca."", ""oportunidad"": ""Las herramientas que ayudan a los consumidores a tomar decisiones informadas a partir de recomendaciones personalizadas están en auge. La AI y el análisis de datos están más accesibles, facilitando el desarrollo de soluciones innovadoras."", ""diferenciacion"": ""A diferencia de las plataformas de reseñas tradicionales que ofrecen información general y no personalizada, nuestra solución utilizaría algoritmos de aprendizaje automático para ofrecer recomendaciones de productos altamente personalizadas basadas en el comportamiento del usuario y preferencias previas.""}"
IDEA-20260215225630,MarketSimplify,SaaS,Una plataforma todo-en-uno para que las PYMES gestionen sus redes sociales y campañas de email marketing de forma sencilla.,"MarketSimplify es una herramienta de marketing digital diseñada específicamente para pequeñas y medianas empresas. Combina la gestión de redes sociales y el email marketing en una interfaz fácil de usar, permitiendo a los empresarios crear, programar y analizar campañas sin complicaciones.",Pequeños y medianos empresarios que buscan mejorar su presencia digital sin complicaciones técnicas.,Las PYMES enfrentan la necesidad de estar presentes en el entorno digital pero carecen de los conocimientos y recursos para implementar estrategias efectivas de marketing.,"Proporcionar una plataforma sencilla y accesible que integre herramientas de redes sociales y email marketing, optimizando el tiempo y esfuerzo de las PYMES en sus campañas digitales.",Media,120,"$29/mes, con una prueba gratuita de 14 días","Gestión de publicaciones en redes sociales, creación de campañas de email, análisis de métricas básicas, plantillas de diseño para campañas.","SEO, publicidad en redes sociales, marketing de contenido, webinars, asociaciones con cámaras de comercio locales.","Hootsuite, Mailchimp, Buffer, pero ninguno combina ambas funcionalidades de manera simple para PYMES.","Un enfoque en la usabilidad y la accesibilidad, así como precios competitivos. También se ofrecerán tutoriales y soporte personalizado para ayudar a los usuarios a maximizar la plataforma.",75,IDEA-20260215225630.html,Sí,2026-02-15T22:56:30.173387,"{""problema_identificado"": ""Los pequeños y medianos empresarios (PYMES) tienen dificultades para acceder a herramientas de marketing digital asequibles y efectivas que les permitan gestionar sus redes sociales y campañas de email marketing."", ""porque_ahora"": ""El crecimiento del comercio electrónico y la digitalización de los negocios ha aumentado la necesidad de herramientas de marketing accesibles. Además, muchas PYMES han quedado atrás en la adopción tecnológica, lo que representa una oportunidad para ofrecer soluciones simples y efectivas."", ""oportunidad"": ""La digitalización en el ámbito empresarial sigue creciendo, y las soluciones centradas en la simplicidad y la usabilidad están en alta demanda. Proporcionar un producto que combine gestión de redes sociales y email marketing en una única plataforma puede atraer a muchas PYMES."", ""diferenciacion"": ""A diferencia de otras herramientas de marketing que son complejas y requieren una curva de aprendizaje significativa, esta solución se enfocará en ser intuitiva y fácil de usar para empresarios sin experiencia en marketing digital.""}"
IDEA-20260215215002,WellTime,SaaS,Una plataforma de gestión del tiempo que integra técnicas de productividad y bienestar emocional.,"WellTime es una aplicación que ayuda a los usuarios a gestionar su tiempo de manera eficiente, al mismo tiempo que promueve el bienestar emocional y mental. Ofrece recordatorios de pausas, técnicas de respiración, y un análisis semanal del tiempo trabajado versus el tiempo de descanso, creando una experiencia equilibrada.","Profesionales que trabajan en entornos remotos o híbridos, así como estudiantes universitarios que buscan equilibrar trabajo y estudio.","Los usuarios luchan por equilibrar sus responsabilidades laborales y personales, lo que conduce a altos niveles de estrés y agotamiento.","Una plataforma que no solo ayuda a planificar y gestionar tareas, sino que también recuerda a los usuarios que tomen descansos y practica técnicas de mindfulness.",Media,120,$9.99/mes,"Gestión de tareas, Recordatorios de pausas, Análisis semanal del tiempo, Técnicas de mindfulness.","Marketing en redes sociales, Publicidad en aplicaciones relacionadas con productividad y bienestar, Colaboraciones con influencers en el ámbito de la salud mental.","Aplicaciones de gestión del tiempo como Todoist o Trello, pero que no incorporan wellness de forma significativa.","WellTime combina la gestión del tiempo con la promoción del bienestar, ofreciendo un enfoque integral que no es común en la mayoría de las aplicaciones de productividad.",75,IDEA-20260215215002.html,Sí,2026-02-15T21:50:02.865491,"{""problema_identificado"": ""La gestión del tiempo personal y profesional es un desafío constante, llevando a la falta de equilibrio entre vida laboral y personal, estrés y agotamiento."", ""porque_ahora"": ""Con el aumento del trabajo remoto y los cambios en la dinámica laboral, más personas están luchando por establecer límites claros entre trabajo y vida personal, lo que ha aumentado la demanda de soluciones efectivas para la gestión del tiempo."", ""oportunidad"": ""El mercado de aplicaciones de productividad está en auge, y las herramientas que abordan el bienestar del usuario están ganando atención, especialmente entre profesionales de diversas industrias que buscan mejorar su calidad de vida."", ""diferenciacion"": ""La solución se centrará no solo en la gestión del tiempo, sino también en el bienestar del usuario, incorporando técnicas de mindfulness y descanso activo, lo que no es común en muchas herramientas actuales.""}"
IDEA-20260215205608,FinanciaSimples,SaaS,Una herramienta de contabilidad y previsión financiera diseñada para pequeñas empresas y emprendedores.,"FinanciaSimples es una plataforma SaaS que permite a las pequeñas empresas gestionar su contabilidad de manera intuitiva y simplificada, además de ofrecer predicciones financieras automáticas basadas en datos históricos y actuales, ayudando a tomar decisiones informadas.",Pequeñas empresas y emprendedores que no tienen formación financiera.,Mala gestión financiera que puede llevar al fracaso de pequeñas empresas.,Una herramienta simple y accesible que permite gestionar la contabilidad y prever finanzas sin necesidad de conocimientos técnicos avanzados.,Media,120,$29/mes,"Gestión de ingresos y egresos, reportes básicos, predicciones financieras simples.","Marketing en redes sociales, colaboraciones con incubadoras de negocios, SEO.","QuickBooks, Xero, pero estas son más complejas y costosas para el público objetivo.","Interfaz amigable, soporte personalizado y enfoque en predicciones financieras para pequeñas empresas.",75,IDEA-20260215205608.html,Sí,2026-02-15T20:56:08.659961,"{""problema_identificado"": ""Las pequeñas empresas y emprendedores enfrentan dificultades para gestionar eficazmente sus finanzas y contabilidad debido a la falta de herramientas accesibles y comprensibles."", ""porque_ahora"": ""La digitalización ha acelerado en el último año, y las pequeñas empresas buscan soluciones que faciliten la gestión financiera a distancia y de manera eficiente."", ""oportunidad"": ""Con el auge del trabajo remoto y la digitalización, hay una creciente necesidad de herramientas que simplifiquen la contabilidad y la planificación financiera para pequeños negocios."", ""diferenciacion"": ""Ofrecer una plataforma que no solo gestione la contabilidad, sino que también brinde predicciones financieras personalizadas usando inteligencia artificial, enfocándose en el público no técnico.""}"
IDEA-20260215195033,Freelance Time Master,SaaS,"Una herramienta todo-en-uno para que freelancers gestionen su tiempo, proyectos y productividad desde una única plataforma.","Freelance Time Master permite a los usuarios planificar tareas, seguir el tiempo dedicado a cada proyecto, y obtener informes sobre su productividad. La aplicación también incluye recordatorios y notificaciones para mantener a los usuarios en el camino.","Freelancers en diversas industrias como diseño gráfico, desarrollo web, redacción, y marketing digital.","Los freelancers luchan por organizar su tiempo y proyectos, lo que puede resultar en estrés y pérdida de clientes.","Una plataforma que combine gestión de tiempo, seguimiento de proyectos y análisis de productividad, ayudando a los freelancers a trabajar de manera más eficiente.",Media,120,$19/mes,"Planificación de tareas, seguimiento de tiempo, informes de productividad","Marketing de contenidos, redes sociales, afiliados en plataformas freelance","Trello, Toggl, Asana, pero estas plataformas no están diseñadas exclusivamente para freelancers.","Integración de funciones clave específicamente para freelancers, como un enfoque en la gestión de proyectos individuales y la flexibilidad necesaria para adaptarse a diferentes flujos de trabajo.",75,IDEA-20260215195033.html,Sí,2026-02-15T19:50:33.664293,"{""problema_identificado"": ""Los profesionales freelance tienen dificultades para gestionar su tiempo y proyectos, lo que lleva a la sobrecarga, falta de organización y pérdida de oportunidades."", ""porque_ahora"": ""Con el aumento del trabajo remoto y la economía freelance, hay una creciente necesidad de herramientas que ayuden a los trabajadores independientes a organizar su tiempo y proyectos de manera eficiente."", ""oportunidad"": ""El mercado de freelancers está en constante crecimiento, y se estima que para 2025, el 50% de la fuerza laboral en EE. UU. será freelance. Esto representa una oportunidad significativa para herramientas que mejoren su productividad."", ""diferenciacion"": ""La solución propuesta integra funcionalidades de gestión del tiempo, seguimiento de proyectos y análisis de productividad en una única plataforma simple y amigable, a diferencia de las herramientas fragmentadas predominantes.""}"
IDEA-20260215190937,PymeDigital,SaaS,Plataforma todo-en-uno para que PYMES gestionen su presencia digital de manera eficiente y accesible.,"PymeDigital es una solución SaaS diseñada para ayudar a pequeñas y medianas empresas a crear, gestionar y optimizar su presencia en línea. Incluye herramientas para crear sitios web, gestionar redes sociales y analizar el rendimiento digital. Todo en un único lugar y con precios accesibles.",Pequeñas y medianas empresas que buscan establecer o mejorar su presencia online.,Las PYMES a menudo no tienen los recursos ni la experiencia para gestionar eficazmente su marketing digital y presencia en línea.,PymeDigital proporciona una interfaz intuitiva y herramientas accesibles para que las PYMES puedan manejar su marketing digital sin necesidad de contratar personal especializado o invertir grandes sumas de dinero.,Media,120,$20/mes,"Creación de website, Gestión básica de redes sociales, Reportes analíticos.","Marketing digital, Redes sociales, Eventos locales para PYMES.","Softwares como Wix, Squarespace y Hootsuite; sin embargo, estos suelen estar dirigidos a usuarios más grandes y con mayores presupuestos.","Enfocamos nuestra plataforma exclusivamente en las necesidades y capacidades económicas de las PYMES, ofreciendo un soporte personalizado y herramientas específicas que abordan sus desafíos únicos.",76,IDEA-20260215190937.html,Sí,2026-02-15T19:09:37.123318,"{""problema_identificado"": ""Muchas pequeñas y medianas empresas (PYMES) carecen de herramientas accesibles para gestionar su presencia en línea de manera efectiva, lo que les impide competir con empresas más grandes."", ""porque_ahora"": ""La digitalización ha acelerado en los últimos años, especialmente tras la pandemia. Las PYMES están buscando urgentemente soluciones para establecerse en el mercado digital."", ""oportunidad"": ""Hay un creciente número de PYMES que quieren mejorar su visibilidad en línea y gestionar sus interacciones con clientes a través de plataformas digitales, lo que abre un mercado amplio y poco atendido."", ""diferenciacion"": ""La solución se centrará en proporcionar un paquete integral y accesible que combine diseño web, gestión de redes sociales y herramientas de analítica en una sola plataforma, adaptada específicamente a las necesidades y presupuestos de las PYMES.""}"
IDEA-20260215175644,FreelanceTime,SaaS,"Una plataforma de gestión del tiempo y tareas diseñada específicamente para freelancers, con un enfoque en la personalización mediante IA.","FreelanceTime es una herramienta que no solo ayuda a los freelancers a organizar su trabajo, sino que también usa inteligencia artificial para ofrecer recomendaciones personalizadas sobre la gestión del tiempo, priorización de tareas y técnicas de productividad.","Freelancers en diversas industrias, desde diseño gráfico hasta programación y redacción.",La falta de herramientas efectivas y personalizadas para gestionar el tiempo y las tareas que se adapten a las necesidades individuales de cada freelancer.,"FreelanceTime ayudará a los freelancers a gestionar su tiempo y tareas más eficientemente, mejorando su productividad a través de recomendaciones personalizadas basadas en IA.",Media,120,$15/mes o $150 one-time,"Gestión de tareas, Cronómetro de tiempo, Recomendaciones personalizadas, Reportes de productividad.","Redes sociales, Marketing de contenidos, Colaboraciones con plataformas de freelancers.","Otras herramientas de gestión de tiempo como Todoist, Trello, y Asana.","La personalización basada en IA que ajusta la experiencia del usuario a sus hábitos y preferencias, lo que proporciona un valor añadido frente a opciones genéricas.",75,IDEA-20260215175644.html,Sí,2026-02-15T17:56:44.958179,"{""problema_identificado"": ""Los profesionales independientes (freelancers) tienen dificultades para gestionar su tiempo y tareas, lo que afecta su productividad y, en consecuencia, sus ingresos."", ""porque_ahora"": ""Con el aumento del trabajo remoto y la economía gig, más personas están optando por ser freelancers, lo que genera una alta demanda de herramientas de gestión personal."", ""oportunidad"": ""Cada vez más freelancers buscan formas de optimizar su tiempo y tareas, y la oferta actual de herramientas no se adapta a sus necesidades específicas de forma efectiva."", ""diferenciacion"": ""La solución propuesta incluirá una integración de IA que personaliza las recomendaciones de gestión del tiempo y tareas según el estilo de trabajo del usuario.""}"
IDEA-20260215170113,TimeTune,SaaS,Herramienta de gestión del tiempo que combina la planificación de tareas con técnicas de gamificación.,"TimeTune es una plataforma de gestión del tiempo diseñada para ayudar a los usuarios a planificar su día de manera efectiva. Utiliza un enfoque de gamificación que convierte el seguimiento de tareas y la gestión del tiempo en un juego, incentivando a los usuarios a cumplir con sus objetivos y a mejorar su productividad de forma divertida.",Profesionales y estudiantes que buscan mejorar su gestión del tiempo y aumentar su productividad.,"Falta de herramientas efectivas para gestionar el tiempo y las tareas, lo que lleva a la procrastinación y al estrés.","Una herramienta que proporciona un enfoque gamificado para la gestión del tiempo, permitiendo a los usuarios visualizar su progreso, establecer objetivos y recibir recompensas virtuales por completar tareas.",Media,120,$10/mes,"Planificador de tareas, Sistema de recompensas, Seguimiento de tiempo, Personalización de la interfaz","Marketing en redes sociales, Colaboraciones con influencers de productividad, Publicidad pagada en plataformas de búsqueda","Todoist, Trello, Notion, pero sin el enfoque gamificado que ofrece TimeTune.","Enfoque único en la gamificación de la gestión del tiempo, adaptándose a los hábitos y preferencias de cada usuario.",75,IDEA-20260215170113.html,Sí,2026-02-15T17:01:13.306019,"{""problema_identificado"": ""La gestión del tiempo y la productividad es un desafío constante para profesionales y estudiantes, que a menudo se sienten abrumados en sus tareas diarias y no saben cómo priorizar su trabajo de manera efectiva."", ""porque_ahora"": ""Con el aumento del trabajo remoto y el aprendizaje en línea, hay una creciente necesidad de herramientas que ayuden a las personas a gestionar su tiempo y tareas de manera eficiente. La reciente tendencia hacia la salud mental también hace que la productividad equilibrada sea un enfoque importante."", ""oportunidad"": ""El mercado de herramientas de productividad está en auge, y muchas soluciones actuales son demasiado complicadas o no se adaptan a las preferencias individuales. Existe una oportunidad para una herramienta simple pero efectiva que aborde la gestión del tiempo desde una perspectiva integral."", ""diferenciacion"": ""La solución propuesta combina técnicas de gestión del tiempo con elementos de gamificación para hacer que la productividad sea más atractiva y accesible. Además, se personaliza según las preferencias y hábitos del usuario.""}"
IDEA-20260215155134,CreativeCollab,SaaS,Plataforma de colaboración en tiempo real para creativos donde pueden compartir y recibir feedback en sus proyectos.,"CreativeCollab es una herramienta donde los creativos pueden presentar sus trabajos, recibir retroalimentación en tiempo real de otros profesionales, organizar sesiones de brainstorming y participar en talleres interactivos. La plataforma incluye herramientas para la gestión de proyectos, comentarios de voz y video, y un sistema de votación para ideas.","Diseñadores, escritores, artistas y otros profesionales creativos que buscan colaboración y retroalimentación activa en su trabajo.",Los creativos suelen trabajar de forma aislada y carecen de un espacio adecuado para recibir feedback constructivo y colaborar con otros en sus proyectos.,"Proporcionar una plataforma dedicada que permita a los creativos colaborar fácilmente, recibir retroalimentación, y mejorar sus habilidades a través de la interacción comunitaria.",Media,120,$15/mes,"Espacios de trabajo colaborativo, sistema de comentarios, funciones de video-chat, gestión de proyectos.","Redes sociales (Instagram, TikTok), Blog de contenido creativo, Publicidad en plataformas para creativos (Behance, Dribbble).","Slack, Figma, y otras plataformas de colaboración, pero no están especializadas en el dominio creativo.","CreativeCollab se enfoca exclusivamente en creativos, ofreciendo herramientas específicamente diseñadas para la mejora del proceso creativo, a diferencia de plataformas de colaboración más genéricas.",75,IDEA-20260215155134.html,Sí,2026-02-15T15:51:34.648824,"{""problema_identificado"": ""Los profesionales creativos (diseñadores, escritores, artistas) luchan por encontrar espacios de trabajo colaborativo donde puedan compartir, recibir retroalimentación y mejorar sus proyectos en comunidad."", ""porque_ahora"": ""Con el aumento del trabajo remoto y la valoración de la colaboración virtual, existe una necesidad creciente de entornos digitales que fomenten la interacción y la creatividad entre colegas de forma eficiente."", ""oportunidad"": ""Las plataformas de colaboración existentes no son específicas ni optimizadas para creativos, lo que deja un nicho interesante sin explorar. Este producto puede captar a una audiencia apasionada que busca mejorar su proceso creativo con apoyo de otros."", ""diferenciacion"": ""A diferencia de otras herramientas de colaboración genéricas, esta solución se centra exclusivamente en las necesidades de los creativos, ofreciendo características y funcionalidades específicas que fomentan la creatividad y el intercambio de ideas.""}"
