ID,Nombre,Tipo,Resumen,Descripción,Público Objetivo,Problema,Solución,Complejidad,Horas Desarrollo,Precio Estimado,MVP Features,Canales,Competencia,Diferenciación,Score Total,Landing URL,Landing Deployed,Created Date,Reasoning
IDEA-20260220050821,AdminEase,SaaS,Una plataforma integral para gestionar las tareas administrativas de PYMES de manera sencilla y eficiente.,"AdminEase ofrece a las pequeñas y medianas empresas una solución all-in-one para la gestión de facturación, seguimiento de clientes y proyectos, y reportes financieros, todo desde una única interfaz intuitiva.",Pequeñas y medianas empresas (PYMES) con menos de 50 empleados.,"Las PYMES carecen de herramientas eficientes para gestionar sus tareas administrativas, lo que les lleva a perder tiempo y recursos.","AdminEase centraliza múltiples funciones administrativas en una sola plataforma, permitiendo a las empresas gestionar todo desde un mismo lugar, reduciendo el tiempo y los costos operativos.",Media,150,$29/mes,"Gestión de facturación, Seguimiento de clientes, Reportes financieros básicos","Marketing digital, Redes sociales, Alianzas con cámaras de comercio locales","QuickBooks, Zoho, FreshBooks","A diferencia de la competencia, AdminEase está diseñada específicamente para pequeñas empresas que buscan simplicidad y funcionalidad a un costo accesible, además de ofrecer una interfaz muy amigable y fácil de usar.",72,IDEA-20260220050821.html,Sí,2026-02-20T05:08:21.424792,"{""problema_identificado"": ""Las pequeñas y medianas empresas (PYMES) tienen dificultades para gestionar sus tareas administrativas de manera eficiente debido a la falta de un sistema integral que agrupe funciones como facturación, gestión de clientes y seguimiento de proyectos."", ""porque_ahora"": ""Con el aumento de la digitalización y el trabajo remoto, las PYMES están buscando soluciones más flexibles y accesibles que les permitan optimizar sus procesos administrativos."", ""oportunidad"": ""El mercado de soluciones para PYMES está creciendo rápidamente, y el software como servicio (SaaS) ha demostrado ser un modelo atractivo por su escasa inversión inicial y sus facilidades de uso."", ""diferenciacion"": ""Este producto se diferenciará por su enfoque en la simplicidad y la integración de múltiples funciones en una sola plataforma, dirigido específicamente a empresas con menos de 50 empleados que no tienen recursos para software complejo y costoso.""}"
IDEA-20260219234808,SocialPulse,SaaS,Herramienta de gestión y análisis de redes sociales para PYMEs que simplifica la planificación de contenido y ofrece insights automatizados.,"SocialPulse es una plataforma que permite a las pequeñas y medianas empresas gestionar sus cuentas de redes sociales en un solo lugar. Ofrece programación de posts, análisis de rendimiento y recomendaciones estratégicas basadas en inteligencia artificial. La herramienta está diseñada para ser intuitiva y accesible, con un enfoque en las necesidades específicas de las PYMEs.",Pequeñas y medianas empresas que buscan mejorar su presencia en redes sociales pero carecen de recursos para contratar un equipo de marketing completo.,"Las PYMEs a menudo no tienen el personal o el conocimiento necesario para gestionar eficazmente sus redes sociales, lo que limita su capacidad para llegar a nuevos clientes.","SocialPulse ayuda a las PYMEs a automatizar la publicación de contenido, analizar el rendimiento de sus campañas y recibir recomendaciones sobre cómo mejorar su estrategia en redes sociales.",Media,120,$29/mes,"Programación de publicaciones, Análisis de rendimiento básico, Recomendaciones personalizadas.","Marketing por email, SEO, Publicidad en redes sociales.","Hootsuite, Buffer, Sprout Social.","A diferencia de otras herramientas, SocialPulse se enfoca exclusivamente en las PYMEs, ofreciendo un soporte más personalizado y recomendaciones adaptadas al tamaño y necesidades de cada empresa.",70,IDEA-20260219234808.html,Sí,2026-02-19T23:48:08.057295,"{""problema_identificado"": ""Las pequeñas y medianas empresas (PYMEs) enfrentan dificultades para gestionar sus redes sociales de manera efectiva y medir el impacto de sus campañas."", ""porque_ahora"": ""En la actualidad, la digitalización de los negocios es esencial y las PYMEs buscan soluciones que les permitan optimizar su tiempo y recursos en marketing digital."", ""oportunidad"": ""Con el crecimiento continuo de las redes sociales como canal de marketing, existe una creciente demanda por herramientas que simplifiquen la gestión y análisis de estas plataformas."", ""diferenciacion"": ""Esta solución ofrecerá un enfoque centrado en la automatización de tareas tediosas, análisis fácil de entender y recomendaciones personalizadas basadas en datos.""}"
IDEA-20260219220315,FinanzasSimplificadas,SaaS,"Una plataforma de gestión financiera todo en uno para freelancers y pequeños emprendedores que simplifica el seguimiento de ingresos y gastos, así como el aprendizaje sobre finanzas.","FinanzasSimplificadas es una herramienta que permite a los usuarios gestionar sus finanzas personales y empresariales de manera sencilla y efectiva. Ofrecemos seguimiento automático de gastos, generación de informes financieros y acceso a contenido educativo para mejorar la gestión financiera.","Freelancers, autónomos y pequeños emprendedores con poca experiencia en gestión financiera.",La falta de herramientas integradas y comprensibles para manejar las finanzas de manera eficaz aumenta el riesgo de errores y estrés financiero en los emprendedores.,"Una plataforma que no solo ayuda a manejar las finanzas, sino que también educa a los usuarios sobre mejores prácticas y estrategias de gestión.",Media,150,$19/mes,"Seguimiento de ingresos y gastos, generación de informes básicos, recursos educativos básicos.","Redes sociales, marketing de contenido, asociaciones con plataformas de freelancers.","Aplicaciones como Wave, QuickBooks y Mint, aunque estas no están especialmente diseñadas para freelancers.","FinanzasSimplificadas combina la gestión financiera con educación financiera, centrándose en el nicho de freelancers y emprendedores, lo que no es común en soluciones existentes.",72,IDEA-20260219220315.html,Sí,2026-02-19T22:03:15.503329,"{""problema_identificado"": ""Los pequeños emprendedores y freelancers a menudo enfrentan dificultades para gestionar sus finanzas personales y de negocio debido a la falta de herramientas accesibles y fáciles de usar que integren estas necesidades."", ""porque_ahora"": ""La digitalización ha crecido significativamente, y más personas están creando negocios independientes. Hay una alta demanda de soluciones que simplifiquen la gestión financiera en este grupo."", ""oportunidad"": ""Existen pocos productos en el mercado que ofrezcan una solución integral específica para freelancers y pequeños emprendedores. Esto permite una diferenciación clara y un enfoque en un nicho en crecimiento."", ""diferenciacion"": ""La propuesta se enfoca en la integración de herramientas financieras y educativas en una sola plataforma, ofreciendo tanto el software para la gestión contable como recursos de apoyo para mejorar la alfabetización financiera.""}"
IDEA-20260219210344,TaskCom,SaaS,Una plataforma de gestión de tareas que integra comunicación en tiempo real para equipos remotos.,"TaskCom es una herramienta digital que permite a los equipos remotos gestionar sus tareas de manera sencilla y mantener una comunicación fluida. Con funciones como listas de tareas compartidas, chat incorporado y notificaciones personalizadas, TaskCom mejora la eficiencia y disminuye la fricción en la colaboración.","Equipos de trabajo remoto, startups y pymes que buscan herramientas sencillas para mejorar su colaboración y gestión de proyectos.",La falta de herramientas que integren gestión de tareas y comunicación en un solo lugar para equipos remotos.,"TaskCom combina ambas funciones en una sola plataforma intuitiva, facilitando la colaboración y la asignación de tareas.",Media,100,$10/mes por usuario,"Gestión de tareas, Chat en tiempo real, Notificaciones, Integraciones básicas (Google Calendar, Slack)","Marketing de contenido, Redes sociales (LinkedIn, Twitter), Publicidad en Google","Trello, Asana, Slack","A diferencia de los competidores que ofrecen soluciones más complejas, TaskCom se enfoca en la simplicidad y en la integración de funciones clave en un solo lugar.",75,IDEA-20260219210344.html,Sí,2026-02-19T21:03:44.361025,"{""problema_identificado"": ""Los equipos de trabajo remotos tienen dificultad para mantener una comunicación clara y el seguimiento de proyectos, lo que reduce la productividad y causa malentendidos."", ""porque_ahora"": ""Con el aumento del trabajo remoto post-pandemia, las empresas buscan soluciones efectivas para gestionar equipos a distancia y mejorar la comunicación."", ""oportunidad"": ""El mercado de herramientas de colaboración y gestión de proyectos está en auge, y muchas soluciones actuales son complejas o poco intuitivas."", ""diferenciacion"": ""La solución se basará en una interfaz minimalista centrada en la simplicidad, combinando la gestión de tareas con funciones de comunicación en tiempo real, lo que la hace accesible para usuarios no técnicos.""}"
IDEA-20260219195328,SocialAuto,SaaS,"Herramienta de gestión de redes sociales automatizada para pymes, que genera contenido optimizado y lo publica en múltiples plataformas.","SocialAuto permite a las pequeñas y medianas empresas generar automáticamente contenido relevante y optimizado para sus redes sociales, programar publicaciones y analizar resultados. Utiliza inteligencia artificial para sugerir las mejores horas de publicación y adaptar el contenido según la audiencia.",Pequeñas y medianas empresas que buscan mejorar su presencia en redes sociales sin necesidad de un equipo dedicado.,La dificultad de gestionar contenido de calidad y la falta de tiempo y recursos para hacerlo adecuadamente.,"Una plataforma que automatiza la creación y publicación de contenido atractivo en redes sociales, facilitando a las pymes una mejor gestión de su marketing digital.",Media,120,$29/mes,"Generador de contenido, Programador de publicaciones, Análisis de resultados","Marketing digital, Redes sociales, Alianzas con asociaciones de pymes","Hootsuite, Buffer, pero ninguno ofrece generación automatizada de contenido como característica principal.","Mientras que la competencia se centra en la gestión y programación de contenido, SocialAuto destaca por su capacidad para generar automáticamente contenido optimizado, lo que ahorra tiempo y esfuerzo a las pymes.",70,IDEA-20260219195328.html,Sí,2026-02-19T19:53:28.651647,"{""problema_identificado"": ""Las pequeñas y medianas empresas (pymes) tienen dificultades para gestionar su presencia en redes sociales de manera efectiva y consistente, lo que afecta su visibilidad y ventas."", ""porque_ahora"": ""Con el aumento del uso de redes sociales para marketing y ventas, especialmente tras la pandemia, las pymes están buscando maneras rentables y efectivas para destacar en línea."", ""oportunidad"": ""La digitalización y el crecimiento del comercio electrónico están en auge, y hay una necesidad creciente de herramientas que simplifiquen la gestión de redes sociales para pymes."", ""diferenciacion"": ""La solución se centrará en la creación automatizada de contenido optimizado para redes sociales utilizando inteligencia artificial, lo cual no es comúnmente ofrecido en el mercado y atraerá a aquellas pymes que no tienen recursos para su gestión.""}"
IDEA-20260219180757,FreelancePay,SaaS,Plataforma todo en uno para la gestión de contratos y pagos de freelancers.,"FreelancePay es una plataforma que permite a los freelancers crear, gestionar y firmar contratos digitalmente, mientras recibe pagos de manera segura a través de múltiples métodos de pago integrados. Facilita el seguimiento de tareas y el cobro de facturas.","Freelancers y autónomos en diversas industrias (diseño, programación, redacción, marketing, etc.).","Los freelancers suelen usar múltiples herramientas para gestionar contratos y pagos, lo que lleva a confusión y retrasos en la recepción de pagos.","Una solución integral que permite a los freelancers gestionar todos sus contratos y pagos desde un solo lugar, optimizando el flujo de trabajo y reduciendo el tiempo invertido en tareas administrativas.",Media,120,$15/mes o $150 one-time por acceso de por vida.,"Creación de contratos, integración de pagos, firma digital, notificaciones de vencimiento.","Redes sociales, marketing de contenido, colaboraciones con plataformas de freelancers, publicidad en línea.","Plataformas como Upwork, PayPal para pagos, pero carecen de una integración específica para freelancers que combine ambos aspectos.","FreelancePay se enfoca exclusivamente en las necesidades del freelancer, ofreciendo una solución optimizada y fácil de usar en un solo lugar.",76,IDEA-20260219180757.html,Sí,2026-02-19T18:07:57.478552,"{""problema_identificado"": ""La dificultad de los freelancers para gestionar sus contratos y recibir pagos de manera eficiente y segura."", ""porque_ahora"": ""Con el aumento del trabajo remoto y la economía de los freelancers, hay una creciente necesidad de herramientas que faciliten la gestión de contratos y pagos en un entorno digital."", ""oportunidad"": ""Los freelancers enfrentan muchos problemas con los métodos tradicionales de pago y falta de transparencia en la gestión de contratos. Hay un gran mercado potencial ya que el número de freelancers sigue creciendo."", ""diferenciacion"": ""La solución combina gestión de contratos y pagos en una única plataforma, con una interfaz intuitiva y adaptada específicamente para freelancers, a diferencia de las soluciones más generales y complejas.""}"
IDEA-20260219151032,PortafolioPro,SaaS,Una plataforma SaaS que permite a los creativos construir y presentar su portafolio online de forma simple y atractiva.,"PortafolioPro es una herramienta diseñada para ayudar a diseñadores, fotógrafos y escritores a crear portafolios digitales impresionantes sin necesidad de conocimientos técnicos. Con una variedad de plantillas personalizables y funcionalidades de integración, los usuarios pueden mostrar su trabajo de manera profesional en minutos.","Diseñadores gráficos, fotógrafos, escritores, artistas visuales y cualquier profesional creativo que necesite presentar su trabajo de forma eficiente.",Dificultad para crear un portafolio atractivo sin contar con habilidades de codificación o diseño web.,"Una plataforma fácil de usar con plantillas personalizables, opciones de arrastrar y soltar, y funcionalidades integradas para compartir y promocionar el portafolio.",Media,150,$15/mes,"Plantillas de portafolio, editor de arrastrar y soltar, integración con redes sociales","Redes sociales, marketing de contenido, SEO, colaboraciones con escuelas de arte y diseño","Wix, Squarespace, Behance","PortafolioPro se enfoca en la facilidad de uso y la personalización rápida, a un precio más accesible que muchas plataformas competidoras. Además, ofrece características específicas para diferentes tipos de creativos.",75,IDEA-20260219151032.html,Sí,2026-02-19T15:10:32.052893,"{""problema_identificado"": ""Los profesionales creativos (diseñadores, fotógrafos, escritores) enfrentan dificultades para organizar y presentar su portafolio de manera atractiva y funcional, lo que afecta su capacidad para atraer clientes."", ""porque_ahora"": ""Con el aumento del trabajo independiente y la necesidad de destacar en un mercado saturado, los creativos están buscando herramientas eficientes para mostrar su trabajo de manera profesional sin requerir habilidades técnicas avanzadas."", ""oportunidad"": ""La creciente demanda por presencia en línea y la digitalización del trabajo freelance ofrece un mercado considerable. Muchas plataformas existentes son complejas y costosas, lo que deja espacio para una solución más accesible y orientada a usuarios no técnicos."", ""diferenciacion"": ""La solución se diferenciará por ser extremadamente intuitiva, permitir personalización rápida con plantillas adaptadas a diferentes profesiones creativas y ofrecer integración con redes sociales y herramientas de marketing.""}"
IDEA-20260219120313,WellBee,SaaS,"Una plataforma que permite a las PYMEs gestionar el bienestar emocional y la productividad de sus empleados a través de encuestas, feedback y análisis de datos.","WellBee ofrece a las empresas herramientas para medir y mejorar el clima laboral mediante encuestas, análisis de satisfacción y seguimiento de proyectos. Además, proporciona recomendaciones personalizadas para fomentar un ambiente de trabajo positivo y productivo.",Pequeñas y medianas empresas que buscan mejorar la gestión de sus recursos humanos y el bienestar de sus empleados.,Las PYMEs carecen de recursos para implementar sistemas efectivos de gestión de personal y bienestar emocional.,WellBee ofrece una solución integral que combina análisis de datos y herramientas de feedback en tiempo real para ayudar a las empresas a entender y mejorar la satisfacción y productividad de sus empleados.,Media,120,$49/mes por empresa,"Encuestas de satisfacción, Dashboard de análisis, Reportes de clima laboral","SEO, Marketing en redes sociales, Webinars y alianzas con asociaciones de PYMEs","Otras herramientas de gestión de recursos humanos como BambooHR o Gusto, pero estas no se enfocan específicamente en el bienestar emocional.","WellBee se diferencia al ofrecer un enfoque específico en el bienestar emocional y la medición del clima laboral, además de un interfaz simple y accesible para PYMEs de cualquier tamaño.",75,IDEA-20260219120313.html,Sí,2026-02-19T12:03:13.265018,"{""problema_identificado"": ""Las pequeñas y medianas empresas (PYMEs) tienen dificultades para gestionar sus recursos humanos de manera eficiente, lo que afecta su productividad y capacidad de retener talento."", ""porque_ahora"": ""Con el crecimiento del trabajo remoto y flexible, las PYMEs necesitan herramientas adaptadas a sus necesidades que les permitan gestionar sus equipos de manera eficiente y en tiempo real."", ""oportunidad"": ""Cada vez más PYMEs buscan digitalizar sus procesos, y hay una creciente presión para crear ambientes laborales positivos que fomenten el bienestar de los empleados."", ""diferenciacion"": ""Nuestra solución se enfoca en la gestión del bienestar emocional y la productividad de los empleados, integrando herramientas de medición de clima laboral y feedback en tiempo real.""}"
IDEA-20260219102750,CreativoGestor,SaaS,"Una plataforma todo en uno para que diseñadores y fotógrafos gestionen proyectos, clientes y facturación de manera sencilla y eficiente.","CreativoGestor es una herramienta diseñada especialmente para profesionales creativos, que integra gestión de proyectos, seguimiento de tiempo, facturación y comunicación con clientes. Su diseño intuitivo busca minimizar la curva de aprendizaje y maximizar la productividad.","Diseñadores gráficos, fotógrafos y otros profesionales creativos que trabajan como freelancers o en pequeñas agencias.",La falta de una solución integrada que facilite la gestión de proyectos y finanzas en el trabajo creativo.,"Una plataforma todo-en-uno que simplifica la gestión de proyectos, comunicación con clientes y facturación, eliminando la necesidad de múltiples herramientas.",Media,150,$15/mes,"Gestión de proyectos, seguimiento de tiempo, creación de facturas.","Marketing en redes sociales, colaboraciones con influenciadores creativos, contenido SEO dirigido a freelancers.","Plataformas como Trello, Asana, y herramientas de facturación como FreshBooks.","CreativoGestor está especialmente diseñado para satisfacer las necesidades de los creativos, con características únicas que permiten una gestión más eficiente y especializada en su tipo de trabajo.",75,IDEA-20260219102750.html,Sí,2026-02-19T10:27:50.838195,"{""problema_identificado"": ""Los profesionales creativos, como diseñadores gráficos y fotógrafos, a menudo luchan por encontrar un espacio centralizado para gestionar sus proyectos, clientes y facturación, lo que resulta en la pérdida de tiempo y recursos."", ""porque_ahora"": ""Con el aumento del trabajo freelance y remoto, hay una necesidad creciente de soluciones que faciliten la gestión de proyectos de manera eficiente. Además, muchas herramientas actuales son demasiado complejas o costosas."", ""oportunidad"": ""El mercado de herramientas para freelancers y creativos ha crecido significativamente, y la búsqueda de soluciones simplificadas está en auge. La digitalización ha acelerado la demanda de herramientas que integren gestión de proyectos y finanzas."", ""diferenciacion"": ""Esta solución se diferencia por su enfoque específico en creativos, ofreciendo una interfaz intuitiva y herramientas especializadas que no están bien atendidas por los competidores actuales.""}"
IDEA-20260219075635,SyncTeam,SaaS,SyncTeam es una plataforma que optimiza la coordinación y la comunicación de equipos remotos al integrar la gestión del tiempo y la comunicación en un solo lugar.,"SyncTeam permite a los usuarios gestionar su tiempo, programar reuniones y comunicarse con sus compañeros de equipo en una plataforma unificada. Los usuarios pueden ver la disponibilidad de sus colegas en tiempo real, enviar mensajes y crear tareas, todo desde una interfaz intuitiva.","Equipos de trabajo remotos, empresas con personal distribuido y freelancers que colaboran con otros profesionales.",La falta de herramientas eficaces que integren la gestión del tiempo y la comunicación en un entorno de trabajo remoto produce ineficiencias y conflictos en la programación de tareas.,"SyncTeam ofrece una solución centralizada para gestionar horarios y facilitar la comunicación efectiva, ayudando a los equipos a ser más productivos.",Media,120,$10/mes por usuario,"Gestión de horarios, Funcionalidad de chat, Integración de calendarios","Marketing digital, Redes sociales, Colaboraciones con influencers en productividad","Herramientas como Slack, Microsoft Teams y Calendly, que ofrecen partes de la solución pero carecen de una integración profunda.","SyncTeam no solo combina chat y gestión del tiempo, sino que también permite visualizar la carga de trabajo de cada miembro, facilitando la asignación de tareas y la planificación de reuniones en función de la disponibilidad de todos.",75,IDEA-20260219075635.html,Sí,2026-02-19T07:56:35.042403,"{""problema_identificado"": ""Los trabajadores remotos y los equipos distribuidos enfrentan dificultades para coordinar sus horarios y mantener una comunicación efectiva, lo que a menudo resulta en malentendidos y falta de productividad."", ""porque_ahora"": ""Con la creciente tendencia hacia el trabajo remoto, especialmente post-pandemia, hay una necesidad urgente de herramientas que faciliten la colaboración y la gestión de equipos distribuidos."", ""oportunidad"": ""Las soluciones existentes son fragmentadas y muchas carecen de características que integren la gestión del tiempo, la comunicación y la asignación de tareas de manera eficiente."", ""diferenciacion"": ""La propuesta de solución se centra en una plataforma que combina la gestión del tiempo con herramientas de comunicación integradas, permitiendo a los equipos ver la disponibilidad de sus compañeros en tiempo real y programar reuniones de forma más inteligente.""}"
